full_name,description,html_url,matched_list,matched_count,pushed_at,size,stargazers_count,language,forks_count,vul_ids
rapid7/metasploit-framework,Metasploit Framework,https://github.com/rapid7/metasploit-framework,['metasploit module OR payload'],1,2021-10-28T00:31:44+0000,649395,25437,Ruby,11695,[]
hahwul/mad-metasploit,"Metasploit custom modules, plugins, resource script and.. awesome metasploit collection",https://github.com/hahwul/mad-metasploit,['metasploit module OR payload'],1,2021-10-28T00:17:03+0000,166798,253,Ruby,77,[]
Patrowl/PatrowlHearsData,"Open-Source Vulnerability Intelligence Center - Unified source of vulnerability, exploit and threat Intelligence feeds",https://github.com/Patrowl/PatrowlHearsData,['exploit'],1,2021-10-28T00:03:20+0000,415640,33,,19,[]
thiagofigcosta/V-REx-v2,Vulnerabilities' Risk of Exploitation,https://github.com/thiagofigcosta/V-REx-v2,['exploit'],1,2021-10-28T00:32:26+0000,28691,0,Python,0,[]
lb3361/gigatron-os,Gigatron program and operating-system level things to exploit a SD card attached to the SPI interface of a RAM & IO expansion board.,https://github.com/lb3361/gigatron-os,['exploit'],1,2021-10-28T00:01:12+0000,203,0,C,0,[]
xiluna/Jinja2-ExploitMe,None,https://github.com/xiluna/Jinja2-ExploitMe,['exploit'],1,2021-10-28T00:38:52+0000,0,0,,0,[]
